{
  "claimable_work_order_ids": [],
  "claimable_work_orders": [],
  "findings": [
    {
      "id": "DR004",
      "message": "WorkOrder in archive queue is not claimable",
      "path": "agent/state/work-orders/archive/WO-CREATE-A-BOUNDED-VERTICAL-DEFECT-SLICE-TO-FIX-LO.json",
      "severity": "warning",
      "work_order_id": "WO-CREATE-A-BOUNDED-VERTICAL-DEFECT-SLICE-TO-FIX-LO"
    },
    {
      "id": "DR004",
      "message": "WorkOrder in archive queue is not claimable",
      "path": "agent/state/work-orders/archive/WO-CREATE-A-BOUNDED-VERTICAL-DEFECT-SLICE-TO-FIX-TH.json",
      "severity": "warning",
      "work_order_id": "WO-CREATE-A-BOUNDED-VERTICAL-DEFECT-SLICE-TO-FIX-TH"
    },
    {
      "id": "DR004",
      "message": "WorkOrder in archive queue is not claimable",
      "path": "agent/state/work-orders/archive/WO-CREATE-A-DOCS-ONLY-BOUNDED-ENABLER-FOR-T2-DRAFT.json",
      "severity": "warning",
      "work_order_id": "WO-CREATE-A-DOCS-ONLY-BOUNDED-ENABLER-FOR-T2-DRAFT"
    },
    {
      "id": "DR004",
      "message": "WorkOrder in archive queue is not claimable",
      "path": "agent/state/work-orders/archive/WO-CREATE-A-NEXT-SESSION-HANDOFF-DOCUMENT-FOR-THE-L.json",
      "severity": "warning",
      "work_order_id": "WO-CREATE-A-NEXT-SESSION-HANDOFF-DOCUMENT-FOR-THE-L"
    },
    {
      "id": "DR004",
      "message": "WorkOrder in archive queue is not claimable",
      "path": "agent/state/work-orders/archive/WO-CREATE-AN-OPERATIONAL-SLICE-FOR-POST-MERGE-LIVE.json",
      "severity": "warning",
      "work_order_id": "WO-CREATE-AN-OPERATIONAL-SLICE-FOR-POST-MERGE-LIVE"
    },
    {
      "id": "DR004",
      "message": "WorkOrder in archive queue is not claimable",
      "path": "agent/state/work-orders/archive/WO-FIX-JUST-DEV-BEST-EFFORT-20260608.json",
      "severity": "warning",
      "work_order_id": "WO-CREATE-A-BOUNDED-OPERATIONAL-SLICE-TO-FIX-JUST-D"
    },
    {
      "id": "DR004",
      "message": "WorkOrder in archive queue is not claimable",
      "path": "agent/state/work-orders/archive/WO-FIX-JUST-RUNTIME-START-STOP-20260608.json",
      "severity": "warning",
      "work_order_id": "WO-CREATE-A-BOUNDED-OPERATIONAL-SLICE-TO-REPAIR-THE"
    },
    {
      "id": "DR004",
      "message": "WorkOrder in archive queue is not claimable",
      "path": "agent/state/work-orders/archive/WO-MIGRATE-TIMWE-SUBSCRIPTION-COMMAND-AUTOMATION-FR.json",
      "severity": "warning",
      "work_order_id": "WO-MIGRATE-TIMWE-SUBSCRIPTION-COMMAND-AUTOMATION-FR"
    },
    {
      "id": "DR004",
      "message": "WorkOrder in archive queue is not claimable",
      "path": "agent/state/work-orders/archive/WO-T0-CONTROL-PLANE-AND-EVIDENCE-RECONCILIATION-REC.json",
      "severity": "warning",
      "work_order_id": "WO-T0-CONTROL-PLANE-AND-EVIDENCE-RECONCILIATION-REC"
    },
    {
      "id": "DR004",
      "message": "WorkOrder in archive queue is not claimable",
      "path": "agent/state/work-orders/archive/WO-TMP-011-001.json",
      "severity": "warning",
      "work_order_id": "WO-TMP-011-001"
    },
    {
      "id": "DR004",
      "message": "WorkOrder in archive queue is not claimable",
      "path": "agent/state/work-orders/archive/WO-TMP-014-001.json",
      "severity": "warning",
      "work_order_id": "WO-TMP-014-001"
    },
    {
      "id": "DR004",
      "message": "WorkOrder in archive queue is not claimable",
      "path": "agent/state/work-orders/archive/WO-TMP-015-001.json",
      "severity": "warning",
      "work_order_id": "WO-TMP-015-001"
    },
    {
      "id": "DR004",
      "message": "WorkOrder in archive queue is not claimable",
      "path": "agent/state/work-orders/archive/WO-TMP-016-001.json",
      "severity": "warning",
      "work_order_id": "WO-TMP-016-001"
    },
    {
      "id": "DR004",
      "message": "WorkOrder in archive queue is not claimable",
      "path": "agent/state/work-orders/archive/WO-TMP-021-001.json",
      "severity": "warning",
      "work_order_id": "WO-TMP-021-001"
    },
    {
      "id": "DR004",
      "message": "WorkOrder in archive queue is not claimable",
      "path": "agent/state/work-orders/archive/WO-TMP-022-001.json",
      "severity": "warning",
      "work_order_id": "WO-TMP-022-001"
    },
    {
      "id": "DR004",
      "message": "WorkOrder in archive queue is not claimable",
      "path": "agent/state/work-orders/archive/WO-TMP-023-001.json",
      "severity": "warning",
      "work_order_id": "WO-TMP-023-001"
    },
    {
      "id": "DR004",
      "message": "WorkOrder in archive queue is not claimable",
      "path": "agent/state/work-orders/archive/WO-TMP-024-001.json",
      "severity": "warning",
      "work_order_id": "WO-TMP-024-001"
    },
    {
      "id": "DR004",
      "message": "WorkOrder in archive queue is not claimable",
      "path": "agent/state/work-orders/archive/WO-TMP-025-001.json",
      "severity": "warning",
      "work_order_id": "WO-TMP-025-001"
    },
    {
      "id": "DR004",
      "message": "WorkOrder in archive queue is not claimable",
      "path": "agent/state/work-orders/archive/WO-TMP-026-001.json",
      "severity": "warning",
      "work_order_id": "WO-TMP-026-001"
    },
    {
      "id": "DR004",
      "message": "WorkOrder in archive queue is not claimable",
      "path": "agent/state/work-orders/archive/WO-TMP-027-001.json",
      "severity": "warning",
      "work_order_id": "WO-TMP-027-001"
    },
    {
      "id": "DR004",
      "message": "WorkOrder in archive queue is not claimable",
      "path": "agent/state/work-orders/archive/WO-TMP-028-001.json",
      "severity": "warning",
      "work_order_id": "WO-TMP-028-001"
    },
    {
      "id": "DR004",
      "message": "WorkOrder in archive queue is not claimable",
      "path": "agent/state/work-orders/archive/WO-TMP-029-001.json",
      "severity": "warning",
      "work_order_id": "WO-TMP-029-001"
    },
    {
      "id": "DR004",
      "message": "WorkOrder in archive queue is not claimable",
      "path": "agent/state/work-orders/archive/WO-TMP-030-001.json",
      "severity": "warning",
      "work_order_id": "WO-TMP-030-001"
    },
    {
      "id": "DR004",
      "message": "WorkOrder in archive queue is not claimable",
      "path": "agent/state/work-orders/archive/WO-TMP-031-001.json",
      "severity": "warning",
      "work_order_id": "WO-TMP-031-001"
    },
    {
      "id": "DR004",
      "message": "WorkOrder in archive queue is not claimable",
      "path": "agent/state/work-orders/archive/WO-TMP-032-001.json",
      "severity": "warning",
      "work_order_id": "WO-TMP-032-001"
    },
    {
      "id": "DR004",
      "message": "WorkOrder in archive queue is not claimable",
      "path": "agent/state/work-orders/archive/WO-TMP-033-001.json",
      "severity": "warning",
      "work_order_id": "WO-TMP-033-001"
    },
    {
      "id": "DR004",
      "message": "WorkOrder in archive queue is not claimable",
      "path": "agent/state/work-orders/archive/WO-TMP-034-001.json",
      "severity": "warning",
      "work_order_id": "WO-TMP-034-001"
    },
    {
      "id": "DR004",
      "message": "WorkOrder in archive queue is not claimable",
      "path": "agent/state/work-orders/archive/WO-TMP-035-001.json",
      "severity": "warning",
      "work_order_id": "WO-TMP-035-001"
    },
    {
      "id": "DR004",
      "message": "WorkOrder in archive queue is not claimable",
      "path": "agent/state/work-orders/archive/WO-TMP-036-001.json",
      "severity": "warning",
      "work_order_id": "WO-TMP-036-001"
    },
    {
      "id": "DR004",
      "message": "WorkOrder in archive queue is not claimable",
      "path": "agent/state/work-orders/archive/WO-TMP-037-001.json",
      "severity": "warning",
      "work_order_id": "WO-TMP-037-001"
    },
    {
      "id": "DR004",
      "message": "WorkOrder in archive queue is not claimable",
      "path": "agent/state/work-orders/archive/WO-TMP-038-001.json",
      "severity": "warning",
      "work_order_id": "WO-TMP-038-001"
    },
    {
      "id": "DR004",
      "message": "WorkOrder in archive queue is not claimable",
      "path": "agent/state/work-orders/archive/WO-TMP-039-001.json",
      "severity": "warning",
      "work_order_id": "WO-TMP-039-001"
    },
    {
      "id": "DR004",
      "message": "WorkOrder in archive queue is not claimable",
      "path": "agent/state/work-orders/archive/WO-TMP-040-001.json",
      "severity": "warning",
      "work_order_id": "WO-TMP-040-001"
    },
    {
      "id": "DR004",
      "message": "WorkOrder in archive queue is not claimable",
      "path": "agent/state/work-orders/archive/WO-TMP-041-001.json",
      "severity": "warning",
      "work_order_id": "WO-TMP-041-001"
    },
    {
      "id": "DR004",
      "message": "WorkOrder in archive queue is not claimable",
      "path": "agent/state/work-orders/archive/WO-TMP-042-001.json",
      "severity": "warning",
      "work_order_id": "WO-TMP-042-001"
    },
    {
      "id": "DR004",
      "message": "WorkOrder in archive queue is not claimable",
      "path": "agent/state/work-orders/archive/WO-TMP-043-001.json",
      "severity": "warning",
      "work_order_id": "WO-TMP-043-001"
    },
    {
      "id": "DR004",
      "message": "WorkOrder in archive queue is not claimable",
      "path": "agent/state/work-orders/archive/WO-TMP-044-001.json",
      "severity": "warning",
      "work_order_id": "WO-TMP-044-001"
    },
    {
      "id": "DR004",
      "message": "WorkOrder in archive queue is not claimable",
      "path": "agent/state/work-orders/archive/WO-TMP-045-001.json",
      "severity": "warning",
      "work_order_id": "WO-TMP-045-001"
    },
    {
      "id": "DR004",
      "message": "WorkOrder in archive queue is not claimable",
      "path": "agent/state/work-orders/archive/WO-TMP-046-001.json",
      "severity": "warning",
      "work_order_id": "WO-TMP-046-001"
    },
    {
      "id": "DR004",